### ISSUE TITLE
Contex-Based auth. demo reproduction

### ISSUE THREAD

**Issue by DaniilKl** [crosscon/CROSSCON-Hypervisor-and-TEE-Isolation-Demos#36]
Hi, I was following the tutorial in `BUILDROOT_NEXMON_INTERGRATION.md` on `kernel_5.10.92-v8+_nexmon_automated` branch, commit `143246f49e38826bea6cd6553229702f4fa663cb` (from this repo https://github.com/crosscon/context-based-auth-nexmon-vm) and I noticed that there seems to be a `make install` step missing during the building of `optee_client`. I think that [this section](https://github.com/crosscon/context-based-auth-nexmon-vm/blob/kernel_5.10.92-v8%2B_nexmon_automated/BUILDROOT_NEXMON_INTEGRATION.md#step-4---build-additional-packages), specifically this part:

```bash
cd optee_client

git checkout master
make CROSS_COMPILE=aarch64-none-linux-gnu- WITH_TEEACL=0 O=out-aarch64
git checkout optee2
make CROSS_COMPILE=aarch64-none-linux-gnu- WITH_TEEACL=0 O=out2-aarch64

cd $ROOT
```

Should instead look like this:

```bash
cd optee_client

git checkout master
make CROSS_COMPILE=aarch64-none-linux-gnu- WITH_TEEACL=0 O=out-aarch64
make CROSS_COMPILE=aarch64-none-linux-gnu- WITH_TEEACL=0 O=out-aarch64 DESTDIR=out-aarch64/export install

git checkout optee2
make CROSS_COMPILE=aarch64-none-linux-gnu- WITH_TEEACL=0 O=out2-aarch64
make CROSS_COMPILE=aarch64-none-linux-gnu- WITH_TEEACL=0 O=out2-aarch64 DESTDIR=out2-aarch64/export install

cd $ROOT
```

When I was following the guide on that specific branch and commit, it results in errors like this when building `optee_test`:

```console
/work/crosscon/optee_test/host/xtest/xtest_test.h:10:10: fatal error: tee_client_api.h: No such file or directory
   10 | #include <tee_client_api.h>
      |          ^~~~~~~~~~~~~~~~~~
compilation terminated.
make[1]: *** [Makefile:199: /work/crosscon/optee_test/out-aarch64/xtest/benchmark_2000.o] Error 1
make[1]: *** [Makefile:20: /work/crosscon/optee_test/out-aarch64/supp_plugin/./test_supp_plugin.o] Error 1
make[1]: Leaving directory '/work/crosscon/optee_test/host/supp_plugin'
make: *** [Makefile:55: test_plugin] Error 2
make: *** Waiting for unfinished jobs....
In file included from /work/crosscon/optee_test/host/xtest/adbg/src/adbg_run.c:10:
./xtest_helpers.h:14:10: fatal error: tee_client_api.h: No such file or directory
   14 | #include <tee_client_api.h>
      |          ^~~~~~~~~~~~~~~~~~
compilation terminated.
```

and adding the `make install` steps seems to fix the issue.

I also have trouble verifying that the whole setup works - I have booted it on a RPi4, but can't seem to get output from the `tcpdump` step:

```console
Welcome to Buildroot
buildroot login: root
# modprobe brcmfmac
[   11.010926] cfg80211: Loading compiled-in X.509 certificates for regulatory database
[   11.032866] cfg80211: Loaded X.509 cert 'sforshee: 00b28ddf47aef9cea7'
[   11.046659] brcmfmac: loading out-of-tree module taints kernel.
[   11.067588] brcmfmac: brcmf_fw_alloc_request: using brcm/brcmfmac43455-sdio for chip BCM4345/6
[   11.191217] usbcore: registered new interface driver brcmfmac
# [   11.369446] random: crng init done
[   11.440152] brcmfmac: brcmf_fw_alloc_request: using brcm/brcmfmac43455-sdio for chip BCM4345/6
[   11.449054] brcmfmac: brcmf_fw_alloc_request: using brcm/brcmfmac43455-sdio for chip BCM4345/6
[   11.463259] brcmfmac: brcmf_c_preinit_dcmds: Firmware: BCM4345/6 wl0: Apr 15 2025 14:21:38 version 7.45.189 (nexmon.org/csi: fdb2-dirty-1)
[   11.510339] ieee80211 phy0: brcmf_construct_chaninfo: Ignoring unexpected firmware channel 106

#
#
#
# lsmod | grep -i brcmfmac
brcmfmac              327680  0
brcmutil               24576  1 brcmfmac
cfg80211              872448  1 brcmfmac
#
#
# makecsiparams -c 12/20 -C 1 -N 1
DBABEQAAAAAAAAAAAAAAAAAAAAAAAAAAAAAAAAAAAAAAAA==
# nexutil -Iwlan0 -s500 -b -l34 -vDBABEQAAAAAAAAAAAAAAAAAAAAAAAAAAAAAAAAAAAAAAAA
==
[   37.832892] brcmfmac: nexmon_nl_ioctl_handler: NEXMON: nexmon_nl_ioctl_handler: Enter
[   37.841017] brcmfmac: nexmon_nl_ioctl_handler: NEXMON: nexmon_nl_ioctl_handler: 0058454e 52 68
[   37.850207] brcmfmac: nexmon_nl_ioctl_handler: NEXMON: nexmon_nl_ioctl_handler: calling brcmf_fil_cmd_data_set, cmd: 500
[   37.865349] brcmfmac: nexmon_nl_ioctl_handler: NEXMON: nexmon_nl_ioctl_handler: Exit
#
# h
#
# iw phy phy0 interface add mon0 type monitor
[   57.331710] brcmfmac: brcmf_vif_add_validate: Attempt to add a MONITOR interface...
[   57.339620] brcmfmac: brcmf_mon_add_vif: brcmf_mon_add_vif called
[   57.346382] brcmfmac: brcmf_mon_add_vif: Adding vif "mon0"
#
#
#
# ifconfig mon0 up
#
#
# tcpdump -i wlan0 dst port 5500
[   71.004831] device wlan0 entered promiscuous mode
[   71.023374] device wlan0 left promiscuous mode
tcpdump: wlan0: That device is not up
# ifconfig wlan0 up
[   79.670861] brcmfmac: brcmf_cfg80211_set_power_mgmt: power save enabled
# tcpdump -i wlan0 dst port 5500
[   81.196511] device wlan0 entered promiscuous mode
tcpdump: verbose output suppressed, use -v[v]... for full protocol decode
listening on wlan0, link-type EN10MB (Ethernet), snapshot length 262144 bytes




^C
0 packets captur[   86.679983] device wlan0 left promiscuous mode
ed
0 packets received by filter
0 packets dropped by kernel
```

Am I missing something/forgetting to do something in the verification steps?
Should I be seeing output at that point from the `tcpdump`?

Here are the [full logs](https://paste.dasharo.com/?df9ce70e02a4f4ab#ALvKu77stQxn8EqtP7T8XEGKi9UgYaBBTKwvixNKyhAC) in case you are interested.

**Comment by DaniilKl** [comment]
The original author is @WiktorG351.

**Comment by pH-Valiu** [comment]
Hi.
First of, thanks for the fix in the building section. 
That building section was directly copied from this Demo, so that "error" actually still persists in rpi4-ws/README.md even on this repository.
Your fix is included in my READMEs now, thank you.

Regarding tcpdump not registering any packets: Based on your logs, nexmon_csi works as intendent. The problem most likely is that your `makecsiparams -c 12/20 ...` statement created a configuration that only listens on the wifi channel 12 having a bandwidth of 20MHz. If that wifi channel with that bandwidth is not used in your area, then no packets will be retrieved, (because none have been sent).
Hence, I added (now) a note in the READMEs issuing you to first use a tool like WifiAnalyzer to find active wifis and extract their channel and bandwidth information to use in `makecsiparams`.

Sometimes I also had the case of tcpdump still not retrieving any data, even if that wifi configuration was active in my area. In those cases, I just switch wifi anyways and it worked again.

**Comment by pH-Valiu** [comment]
Only 2.4 GHz Wifis valid

**Comment by WiktorG351** [comment]
@pH-Valiu thank you for the quick reply.
I have managed to get it to work, or at least I assume that I did based on this output

```console
# makecsiparams -c 11/20 -C 1 -N 1
CxABEQAAAAAAAAAAAAAAAAAAAAAAAAAAAAAAAAAAAAAAAA==
# nexutil -Iwlan0 -s500 -b -l34 -vCxABEQAAAAAAAAAAAAAAAAAAAAAAAAAAAAAAAAAAAAAAAA
==
[ 1147.359195] brcmfmac: nexmon_nl_ioctl_handler: NEXMON: nexmon_nl_ioctl_handler: Enter
[ 1147.367276] brcmfmac: nexmon_nl_ioctl_handler: NEXMON: nexmon_nl_ioctl_handler: 0058454e 52 68
[ 1147.376454] brcmfmac: nexmon_nl_ioctl_handler: NEXMON: nexmon_nl_ioctl_handler: calling brcmf_fil_cmd_data_set, cmd: 500
[ 1147.391544] brcmfmac: nexmon_nl_ioctl_handler: NEXMON: nexmon_nl_ioctl_handler: Exit
# 
# 
# 
# tcpdump -i wlan0 dst port 5500
[ 1155.392648] device wlan0 entered promiscuous mode
tcpdump: verbose output suppressed, use -v[v]... for full protocol decode
listening on wlan0, link-type EN10MB (Ethernet), snapshot length 262144 bytes
00:19:15.501715 IP 10.10.10.10.5500 > 255.255.255.255.5500: UDP, length 274
00:19:15.501887 IP 10.10.10.10.5500 > 255.255.255.255.5500: UDP, length 274
00:19:15.603123 IP 10.10.10.10.5500 > 255.255.255.255.5500: UDP, length 274
00:19:15.704218 IP 10.10.10.10.5500 > 255.255.255.255.5500: UDP, length 274
00:19:15.704386 IP 10.10.10.10.5500 > 255.255.255.255.5500: UDP, length 274
00:19:15.704524 IP 10.10.10.10.5500 > 255.255.255.255.5500: UDP, length 274
00:19:15.704697 IP 10.10.10.10.5500 > 255.255.255.255.5500: UDP, length 274
00:19:15.806553 IP 10.10.10.10.5500 > 255.255.255.255.5500: UDP, length 274
00:19:15.806728 IP 10.10.10.10.5500 > 255.255.255.255.5500: UDP, length 274
00:19:15.909384 IP 10.10.10.10.5500 > 255.255.255.255.5500: UDP, length 274
00:19:15.909568 IP 10.10.10.10.5500 > 255.255.255.255.5500: UDP, length 274
00:19:16.012258 IP 10.10.10.10.5500 > 255.255.255.255.5500: UDP, length 274
00:19:16.012433 IP 10.10.10.10.5500 > 255.255.255.255.5500: UDP, length 274
00:19:16.012572 IP 10.10.10.10.5500 > 255.255.255.255.5500: UDP, length 274
00:19:16.012709 IP 10.10.10.10.5500 > 255.255.255.255.5500: UDP, length 274
00:19:16.113754 IP 10.10.10.10.5500 > 255.255.255.255.5500: UDP, length 274
00:19:16.115095 IP 10.10.10.10.5500 > 255.255.255.255.5500: UDP, length 274
00:19:16.216197 IP 10.10.10.10.5500 > 255.255.255.255.5500: UDP, length 274
00:19:16.278321 IP 10.10.10.10.5500 > 255.255.255.255.5500: UDP, length 274
00:19:16.278479 IP 10.10.10.10.5500 > 255.255.255.255.5500: UDP, length 274
00:19:16.318685 IP 10.10.10.10.5500 > 255.255.255.255.5500: UDP, length 274
00:19:16.318841 IP 10.10.10.10.5500 > 255.255.255.255.5500: UDP, length 274
00:19:16.318973 IP 10.10.10.10.5500 > 255.255.255.255.5500: UDP, length 274
00:19:16.329765 IP 10.10.10.10.5500 > 255.255.255.255.5500: UDP, length 274
00:19:16.421220 IP 10.10.10.10.5500 > 255.255.255.255.5500: UDP, length 274
00:19:16.421377 IP 10.10.10.10.5500 > 255.255.255.255.5500: UDP, length 274
```

It might be a good idea to add info about connecting to wifi on the RPi during the verification. At least I assume it needs to be done, because in order to collect CSI, the wifi interface `wlan0` must be associated with an access point.

Or is my understanding of the whole process incorrect?

**Comment by pH-Valiu** [comment]
Yes, your output looks correct.
You were following the guide BUILDROOT_NEXMON_INTEGRATION.md. Regarding future use and on how to communicate with nexmon_csi in the full CRHypervisor setup, I recommend looking at the default README.md in the branch [here](https://github.com/crosscon/context-based-auth-nexmon-vm/blob/kernel_5.10.92-v8%2B_nexmon_automated/README.md), which describes the shared memory protocol on how to communicate and extract CSI data. This allows you to dynamically set channel & bandwidth as well.
As of my understanding, `wlan0` is just the in-built default wifi interface that the broadcom driver uses to send and receive wifi packets. It has nothing to do with the access points in its area.

But @fabianschm : You might have the better understanding of the full pipeline to answer this question properly.

**Comment by WiktorG351** [comment]
@pH-Valiu 
> Yes, your output looks correct

I only managed to achieve this output precisely because before running those commands, I connected to wifi on the rpi4.
What my original question was trying to ask is, do I have to connect to wifi for the packets to appear?

Or should just running these commands after booting:

```bash
modprobe brcmfmac
# not connecting to wifi
makecsiparams -c 12/20 -C 1 -N 1
killall wpa_supplicant
ifconfig wlan0 up
nexutil -Iwlan0 -s500 -b -l34 -v<parameter>
iw phy phy0 interface add mon0 type monitor
ifconfig mon0 up
tcpdump -i wlan0 dst port 5500
# should I see packets here, if I haven't connected to any network?
```

work by itself?

Because from my understanding right now, I have to connect to a network first, then adjust the `makecsiparams` command with correct `-c` flag for that network

**Comment by pH-Valiu** [comment]
I see. I never used wifi to connect to RPI, instead I used UART.
Hence, no wifi connection needed.

In fact, by killing wpa_supplicant you destroy any wifi connections that were established prior.
By modifying the `-c` flag of `makecsiparams`, you can listen on any wifi "network" in you area, assuming it is physically there to begin with.

Then following your question: Have you ever tried connecting over UART and then launching nexmon_csi?

**Comment by WiktorG351** [comment]
@pH-Valiu okay, thank you, that cleared everything up.

I was connecting through uart - i just wasn't adjusting the `makecsiparams` `-C` argument right, and was trying to use a 5Ghz Wifi. I've managed to get it to work.

```console
Starting syslogd: OK
Starting klogd: OK
Running sysctl: OK
Saving random seed: [    7.157174] random: dd: uninitialized urandom read (512 bytes read)
OK
Starting network: ip: RTNETLINK answers: File exists
FAIL

Welcome to Buildroot
buildroot login: root
# modprobe brcmfmac
[   27.845401] cfg80211: Loading compiled-in X.509 certificates for regulatory database
[   27.867494] cfg80211: Loaded X.509 cert 'sforshee: 00b28ddf47aef9cea7'
[   27.880925] brcmfmac: loading out-of-tree module taints kernel.
[   27.901911] brcmfmac: brcmf_fw_alloc_request: using brcm/brcmfmac43455-sdio for chip BCM4345/6
[   28.024758] usbcore: registered new interface driver brcmfmac
# [   28.182535] random: crng init done
[   28.273698] brcmfmac: brcmf_fw_alloc_request: using brcm/brcmfmac43455-sdio for chip BCM4345/6
[   28.282594] brcmfmac: brcmf_fw_alloc_request: using brcm/brcmfmac43455-sdio for chip BCM4345/6
[   28.296601] brcmfmac: brcmf_c_preinit_dcmds: Firmware: BCM4345/6 wl0: Apr 15 2025 14:21:38 version 7.45.189 (nexmon.org/csi: fdb2-dirty-1)
[   28.343785] ieee80211 phy0: brcmf_construct_chaninfo: Ignoring unexpected firmware channel 106

# 
# 
# killall wpa_supplicant
killall: wpa_supplicant: no process killed
# makecsiparams -c 6/20 -C 1 -N 1
BhABEQAAAAAAAAAAAAAAAAAAAAAAAAAAAAAAAAAAAAAAAA==
# 
# ifconfig wlan0 up
[   57.497494] brcmfmac: brcmf_cfg80211_set_power_mgmt: power save enabled
# nexutil -Iwlan0 -s500 -b -l34 -v<parameter>
-sh: syntax error: unexpected newline
# nexutil -Iwlan0 -s500 -b -l34 -vBhABEQAAAAAAAAAAAAAAAAAAAAAAAAAAAAAAAAAAAAAAAA
==
[   70.921653] brcmfmac: nexmon_nl_ioctl_handler: NEXMON: nexmon_nl_ioctl_handler: Enter
[   70.929727] brcmfmac: nexmon_nl_ioctl_handler: NEXMON: nexmon_nl_ioctl_handler: 0058454e 52 68
[   70.938911] brcmfmac: nexmon_nl_ioctl_handler: NEXMON: nexmon_nl_ioctl_handler: calling brcmf_fil_cmd_data_set, cmd: 500
[   70.974161] brcmfmac: nexmon_nl_ioctl_handler: NEXMON: nexmon_nl_ioctl_handler: Exit
# 
# 
# iw phy phy0 interface add mon0 type monitor
[   77.644482] brcmfmac: brcmf_vif_add_validate: Attempt to add a MONITOR interface...
[   77.652414] brcmfmac: brcmf_mon_add_vif: brcmf_mon_add_vif called
[   77.659106] brcmfmac: brcmf_mon_add_vif: Adding vif "mon0"
# ifconfig mon0 up
# tcpdump -i wlan0 dst port 5500
[   85.525726] device wlan0 entered promiscuous mode
tcpdump: verbose output suppressed, use -v[v]... for full protocol decode
listening on wlan0, link-type EN10MB (Ethernet), snapshot length 262144 bytes
00:01:25.545571 IP 10.10.10.10.5500 > 255.255.255.255.5500: UDP, length 274
00:01:25.649765 IP 10.10.10.10.5500 > 255.255.255.255.5500: UDP, length 274
00:01:25.752181 IP 10.10.10.10.5500 > 255.255.255.255.5500: UDP, length 274
00:01:25.953917 IP 10.10.10.10.5500 > 255.255.255.255.5500: UDP, length 274
00:01:26.161880 IP 10.10.10.10.5500 > 255.255.255.255.5500: UDP, length 274
00:01:26.264322 IP 10.10.10.10.5500 > 255.255.255.255.5500: UDP, length 274
00:01:26.366673 IP 10.10.10.10.5500 > 255.255.255.255.5500: UDP, length 274
00:01:26.571718 IP 10.10.10.10.5500 > 255.255.255.255.5500: UDP, length 274
00:01:26.673869 IP 10.10.10.10.5500 > 255.255.255.255.5500: UDP, length 274
00:01:26.878696 IP 10.10.10.10.5500 > 255.255.255.255.5500: UDP, length 274
00:01:26.983751 IP 10.10.10.10.5500 > 255.255.255.255.5500: UDP, length 274
00:01:27.084616 IP 10.10.10.10.5500 > 255.255.255.255.5500: UDP, length 274
00:01:27.183384 IP 10.10.10.10.5500 > 255.255.255.255.5500: UDP, length 274

13 packets captu[   87.280672] device wlan0 left promiscuous mode
red
13 packets received by filter
0 packets dropped by kernel
^C# 
CTRL-A Z for help | 115200 8N1 | NOR | Minicom 2.9 | VT102 | Offline | ttyUSB0                                                                                                                                                              
```

**Comment by DaniilKl** [comment]
@pH-Valiu, @fabianschm could you please elaborate more what is going on here:

```
# tcpdump -i wlan0 dst port 5500
[   85.525726] device wlan0 entered promiscuous mode
tcpdump: verbose output suppressed, use -v[v]... for full protocol decode
listening on wlan0, link-type EN10MB (Ethernet), snapshot length 262144 bytes
00:01:25.545571 IP 10.10.10.10.5500 > 255.255.255.255.5500: UDP, length 274
00:01:25.649765 IP 10.10.10.10.5500 > 255.255.255.255.5500: UDP, length 274
00:01:25.752181 IP 10.10.10.10.5500 > 255.255.255.255.5500: UDP, length 274
00:01:25.953917 IP 10.10.10.10.5500 > 255.255.255.255.5500: UDP, length 274
00:01:26.161880 IP 10.10.10.10.5500 > 255.255.255.255.5500: UDP, length 274
00:01:26.264322 IP 10.10.10.10.5500 > 255.255.255.255.5500: UDP, length 274
00:01:26.366673 IP 10.10.10.10.5500 > 255.255.255.255.5500: UDP, length 274
00:01:26.571718 IP 10.10.10.10.5500 > 255.255.255.255.5500: UDP, length 274
00:01:26.673869 IP 10.10.10.10.5500 > 255.255.255.255.5500: UDP, length 274
00:01:26.878696 IP 10.10.10.10.5500 > 255.255.255.255.5500: UDP, length 274
00:01:26.983751 IP 10.10.10.10.5500 > 255.255.255.255.5500: UDP, length 274
00:01:27.084616 IP 10.10.10.10.5500 > 255.255.255.255.5500: UDP, length 274
00:01:27.183384 IP 10.10.10.10.5500 > 255.255.255.255.5500: UDP, length 274

13 packets captu[   87.280672] device wlan0 left promiscuous mode
red
13 packets received by filter
0 packets dropped by kernel
```

What packets are being intercepted and how they will be used later in Context-Based Authentication?

**Comment by fabianschm** [comment]
The Context-based Authentication uses the Channel State Information (CSI) contained as a physical property in every WiFi packet. Every WiFi radio channel is subdivided into multiple subchannels ("smaller slices" of the radio spectrum). The amount of subchannels is determined by the channel bandwidth (e.g. 20 MHz yield 64 subchannels). The CSI consists of amplitude and phase for each of those subchannels as they're received by the Pi's WiFi hardware. It is influenced by the physical environment the devices are in, and by the devices themselves.

The modified WiFi firmware & driver extract this CSI data from every packet it receives. It is then wrapped into a UDP packet with origin IP 10.10.10.10 and addressed to port 5500 so that userspace applications can read the data. Here, tcpdump is used to proof that the receiving works. On the hypervisor, this task is handled by a script running inside the VM. It communicates with the trusted application via shared memory.

I hope this answers your question.

**Comment by DaniilKl** [comment]
> I hope this answers your question.

Thank you, it does.
